date,category,index,title,summary,importance,impact_score,reason,source,url,tags,created_at
2025-12-11,国际,8,"India Draws $52 Billion From Amazon, Microsoft in Tech Expansion",12月11日消息，亚马逊和微软宣布在印度追加总计520亿美元的新投资，用于人工智能、云服务和在线零售等领域，凸显了印度作为全球关键增长市场的战略地位正急剧上升。,中,165.0,重大商业动态：美国科技巨头在关键新兴市场进行超大规模投资，涉及AI基础设施，对全球AI产业格局和地缘竞争有重要影响。,Bloomberg Technology,https://www.bloomberg.com/news/articles/2025-12-10/crypto-elite-shun-nfts-for-69-million-year-old-dinosaur-fossils,"市场投资,地缘竞争,AI基础设施",2025-12-11 09:35:11
2025-12-11,国际,9,Google’s answer to the AI arms race — promote the guy behind its data center tech,12月11日消息，谷歌晋升其数据中心技术负责人阿明·瓦赫达特为新设立的AI基础设施首席技术官，直接向CEO汇报，此举旨在整合资源，全力应对日益激烈的AI算力基础设施竞赛。,中,165.0,重大商业动态：反映了谷歌在AI军备竞赛中通过高层重组来强化其基础设施战略的核心应对措施，属于关键的企业战略调整。,Bloomberg Technology,https://www.bloomberg.com/news/articles/2025-12-10/intel-amd-accused-of-failing-to-block-chips-in-russian-missiles,"企业战略,基础设施,人事重组",2025-12-11 09:35:11
2025-12-11,国际,10,Netflix’s WBD bid is an antitrust drama without a villain,12月11日消息，奈飞对华纳兄弟探索公司的收购要约引发关注，分析指出反垄断审查的核心将围绕如何界定“相关市场”，这场交易可能成为考验当前反垄断执法理念的经典案例。,中,165.0,重大政策与法规：涉及大型科技媒体公司的重大并购，其进程将受到反垄断审查的深刻影响，关乎市场竞争格局。,Financial Times Tech,https://www.ft.com/content/2e56f267-309a-408d-a8e9-1571907f6a46,"反垄断,并购,媒体科技",2025-12-11 09:35:11
2025-12-11,国际,11,Google launches managed MCP servers that let AI agents simply plug into its tools,12月11日消息，谷歌推出托管式MCP服务器，旨在使其服务“为智能体而生”，首先从地图和BigQuery开始，以简化AI智能体与现实世界工具集成的复杂流程，推动智能体应用的普及。,中,158.0,重大产品发布：谷歌发布旨在降低AI智能体开发门槛的关键平台工具，对推动下一代AI应用（智能体）的生态发展有重要意义。,The Verge AI,https://www.theverge.com/news/841540/openai-slack-ceo-denise-dresser-chief-revenue-officer,"AI平台,智能体,开发者工具",2025-12-11 09:35:11
2025-12-11,国际,12,Oracle Drops on Disappointing Cloud Sales,12月11日消息，甲骨文公司财报显示其AI数据中心支出大幅增加，但云业务销售额为79.8亿美元，基础设施业务收入为40.8亿美元，均略低于市场预期，导致股价下跌。,低,157.5,重大商业动态：反映了传统云服务商在AI投资浪潮下的财务表现与市场预期之间的落差，是观察AI基础设施竞赛中企业表现的一个指标。,Bloomberg Technology,https://www.bloomberg.com/news/videos/2025-12-10/cleo-capital-s-kunst-on-adobe-synopsys-and-oracle-video,"企业财报,云计算,AI投资",2025-12-11 09:35:11
2025-12-11,国际,13,Figma launches new AI-powered object removal and image extension,12月11日消息，设计协作平台Figma推出了全新的AI驱动图像编辑工具栏，集成了对象移除和图像扩展等功能，旨在提升设计师的工作效率并整合其AI功能。,低,157.5,重大产品发布：知名设计软件公司发布重要的AI功能更新，属于AI工具在垂直领域渗透和产品迭代的典型案例。,Bloomberg Technology,https://www.bloomberg.com/news/videos/2025-12-10/is-india-finally-having-its-ai-moment-video,"生成式AI,生产力工具,产品更新",2025-12-11 09:35:11
2025-12-11,国际,14,Hinge founder leaves CEO role to launch AI-powered dating startup,12月11日消息，知名交友应用Hinge的创始人贾斯汀·麦克劳德辞去CEO职务，转而创立一家名为Overtone的AI驱动交友服务初创公司，探索AI在社交匹配领域的创新应用。,低,147.5,重大商业动态：知名创业者离开成熟公司，投身AI社交创业，反映了AI技术向细分应用场景（如社交）渗透的趋势和创业动向。,MIT Technology Review,https://www.technologyreview.com/2025/12/10/1128999/exclusive-ebook-aging-clocks-understanding-why-we-age/,"AI创业,社交应用,人事变动",2025-12-11 09:35:11
2025-12-12,国内,1,三部门：自2026年1月1日起优化部分锂亚硫酰氯电池进出口监管措施,12月12日消息，中国工业和信息化部、商务部、海关总署联合发布通知，宣布自2026年1月1日起，对亚硫酰氯含量不超过1千克的锂亚硫酰氯电池或电池组优化进出口监管措施，将其移出监控化学品及两用物项管制清单，无需再办理相关许可，以降低企业合规成本并促进相关产业发展。,高,381.0,属于【重大政策与法规】，由三个中央部委联合发布，涉及进出口管制政策的调整，对相关产业链有直接影响。,36氪,https://36kr.com/p/3591792921640960?f=rss,"政策法规,进出口监管,三部门联合",2025-12-12 08:40:08
2025-12-12,国内,2,商汤方舟SenseFoundry平台全面升级，要打造下一代城市智能底座｜最前线,12月12日消息，商汤科技在香港正式发布其旗舰平台“商汤方舟”的全面升级路径，旨在通过新一代视觉AI技术解决传统算法研发周期长、成本高的痛点，打造面向智慧城市与产业智能化的下一代城市智能底座，推动AI规模化应用。,高,330.0,属于【重大产品发布】，中国头部AI公司商汤科技发布其核心平台产品的重大升级，涉及城市智能化战略。,AI科技评论,https://www.leiphone.com/category/transportation/mVVSDrUnA0O92sQ8.html,"产品发布,智慧城市,商汤科技,平台升级",2025-12-12 08:40:08
2025-12-12,国内,3,机器人秒变推理大师 星尘具身推理模型Lumo-1 VLA发布,12月12日消息，星尘智能发布具身推理模型Lumo-1 VLA，该模型旨在解决机器人在开放环境中执行多步骤长时序任务的推理难题，通过增强对上下文和意图的理解，让机器人能更准确地处理复杂操作，推动具身智能向更高阶发展。,高,315.0,属于【重大学术突破/产品发布】，中国公司发布具身智能领域的突破性模型，旨在解决核心的推理与泛化问题。,AI科技评论,https://www.leiphone.com/category/ai/RXNB8tRsyUkhT8We.html,"模型发布,具身智能,机器人,推理模型",2025-12-12 08:40:08
2025-12-12,国内,4,地平线创始人兼CEO余凯：高阶智驾不再高高在上，正在飞入寻常百姓家,12月12日消息，地平线在深圳举办首届技术生态大会，创始人余凯阐述了公司以自动驾驶为基点构建物理AI基座的战略，并强调通过开放生态与合作，推动高阶智能驾驶技术从高端车型向更大众化的市场普及。,高,285.0,属于【重大商业动态/战略发布】，中国自动驾驶芯片领军企业发布重要生态战略，预示行业向规模化普及的关键转向。,AI科技评论,https://www.leiphone.com/category/transportation/wG6WRl3e4Ov18nlE.html,"战略发布,自动驾驶,生态合作,地平线",2025-12-12 08:40:08
2025-12-12,国内,5,金融智能体进入规模落地期 蚂蚁数科被评综合领导者,12月12日消息，艾瑞咨询发布报告，将蚂蚁集团旗下蚂蚁数科评为中国金融智能体领域的综合领导者，认可其将深度金融业务理解与企业级AI工程能力融合的核心竞争力，在AI原生应用、风控、营销等多场景推动金融机构数智化转型。,高,270.0,属于【重大商业动态】，权威报告确认中国头部金融科技公司在AI核心赛道（金融智能体）的领先地位，反映行业落地趋势。,量子位,https://www.qbitai.com/2025/12/360439.html,"行业报告,金融科技,蚂蚁数科,市场领导者",2025-12-12 08:40:08
2025-12-12,国内,6,世航连续完成多轮数亿元融资，巩固海洋具身机器人全球领先身位,12月12日消息，海洋具身机器人公司世航智能在短期内连续完成多轮数亿元融资，由祥峰投资领投，老股东金沙江创投追投，资金将用于加速产品技术迭代与核心零部件量产，以巩固其在全球该领域的领先地位。,高,264.0,属于【重大商业动态】，中国公司在具身智能细分赛道（海洋机器人）获得大额连续融资，金额达数亿元，且目标是巩固全球领先地位。,36氪,https://36kr.com/p/3590949390024708?f=rss,"大额融资,具身智能,机器人,全球领先",2025-12-12 08:40:08
2025-12-12,国内,7,电子刹车第一“告”背后：理想、小鹏、鸿蒙等抢滩线控底盘,12月12日消息，国内主流车企如理想、小鹏、奇瑞、鸿蒙智行等均已定点供应商，推进EMB电子机械制动系统量产，预计2026年装车；同时，产业链出现首起知识产权诉讼，伯特利起诉坐标系公司专利侵权，凸显技术竞争白热化。,高,245.0,属于【重大商业动态】与【安全与伦理】（知识产权争议）的结合，揭示了中国智能汽车产业链在关键技术（线控底盘）上的量产进程与竞争纠纷。,36氪,https://36kr.com/p/3590737858183168?f=rss,"产业链,量产在即,知识产权诉讼,智能汽车",2025-12-12 08:40:08
2025-12-12,国内,8,黑芝麻智能与元戎启行达成深度合作，共推高阶辅助驾驶技术量产落地,12月12日消息，自动驾驶芯片公司黑芝麻智能与自动驾驶解决方案公司元戎启行宣布达成深度合作，双方将基于黑芝麻下一代芯片平台，联合打造高性能、高性价比的高阶辅助驾驶方案，并探索Robotaxi等新场景，加速技术规模化落地。,中,240.0,属于【重大商业动态】，两家中国自动驾驶领域的重要公司达成“资本+业务”双重合作，旨在联合推进高阶智驾方案量产。,36氪,https://36kr.com/p/3580832429177731?f=rss,"战略合作,自动驾驶,芯片,量产落地",2025-12-12 08:40:08
2025-12-12,国内,9,独家｜OPPO AI部门再次整合，成立智慧产品研发部,12月12日消息，OPPO对AI中心进行新一轮组织架构调整，将原小布记忆、小布助手等核心业务整合为“超级小布”，并由新成立的智慧产品研发部统一负责，旨在进一步聚焦AI能力，打通AI与操作系统（OS）的协同。,中,236.0,属于【重大商业动态】，中国头部手机厂商对核心AI业务进行重大组织整合，反映了其在AI战略上的深度调整与聚焦。,36氪,https://36kr.com/p/3591922997018888?f=rss,"组织架构调整,AI战略,OPPO,业务整合",2025-12-12 08:40:08
2025-12-12,国内,10,千问App：近一周年终总结、述职报告等生成量大涨10倍,12月12日消息，阿里旗下千问App数据显示，在免费开放PPT能力后的一周内，用户生成的年终总结、述职报告等文档数量暴涨10倍，单周产出超100万份，显示其AI办公工具在特定场景下的应用已形成规模效应。,中,225.0,属于【重大商业动态】，中国头部AI应用（阿里千问）公布其核心功能（文档生成）取得显著的用户增长和场景落地数据。,AI科技评论,https://www.leiphone.com/category/iot/8ynOTg1vcklcguOq.html,"应用落地,用户增长,阿里千问,AI办公",2025-12-12 08:40:08
2025-12-12,国内,11,氪星晚报｜朱啸虎：十年后中国AI肯定领先美国；夸克AI眼镜“一机难求”，核心供应商曝已新增产线,12月12日消息，投资人朱啸虎公开表示看好中国AI发展前景；同时，阿里旗下夸克AI眼镜因市场需求火爆出现“一机难求”，核心供应商立讯精密已新增产线以提升产能，预计明年1月充分释放以满足春节消费需求。,中,210.0,属于【重大商业动态】，包含中国投资人对行业的趋势判断，以及中国AI硬件产品（夸克AI眼镜）市场反响热烈、供应链紧急扩产的重要动态。,AI科技评论,https://www.leiphone.com/category/transportation/ZDSs64WWOoJXMmZm.html,"行业观点,AI硬件,供应链,市场需求",2025-12-12 08:40:08
2025-12-12,国内,12,福瑞泰克张林：中国企业走向世界是必然，继续与海外Tier 1同台竞技,12月12日消息，福瑞泰克董事长张林在地平线生态大会上表示，中国自主Tier1企业走向世界是必然趋势，并以福瑞泰克与地平线合作实现城市NOA方案快速量产的实践为例，展现了中国智能驾驶生态从追赶到引领的能力。,中,186.0,属于【重大商业动态】，中国本土自动驾驶Tier1领军企业高管发表重要产业观点，并展示其技术量产成果，具有行业代表性。,36氪,https://36kr.com/newsflashes/3592267496882177?f=rss,"产业观点,自动驾驶,出海,量产成果",2025-12-12 08:40:08
2025-12-12,国内,13,一汽奔腾杨兴龙：征程6P芯片搭载于悦意08，将于明年正式发布,12月12日消息，一汽奔腾副总经理杨兴龙在地平线生态大会上宣布，其新车悦意08将搭载地平线征程6P芯片，并于明年正式发布，这体现了传统车企与国产AI芯片公司在智能化领域的深度合作与产品进展。,中,165.0,属于【重大商业动态】，中国大型国有车企公布其具体车型将搭载国产AI芯片（地平线征程6）的计划，是产业合作的重要进展。,AI科技评论,https://www.leiphone.com/category/ai/SJMi7xhrknuVadzq.html,"车企合作,芯片上车,产品发布计划,一汽奔腾",2025-12-12 08:40:08
2025-12-12,国内,14,李泽湘看好的电动智能摩托艇公司，再获HKX基金、清水湾基金投资｜硬氪首发,12月12日消息，专注于休闲船艇电动化与智能化的安澜动力科技完成千万元级天使+轮融资，投资方包括香港X科技基金和清水湾基金，资金将用于产品样机迭代研发与测试，该公司由知名孵化机构深圳科创学院孵化。,低,165.0,属于【重大商业动态】，一家中国AI+硬件初创公司获得融资，金额为千万元级，虽非十亿级，但投资方背景和赛道（电动化、智能化）值得关注。,量子位,https://www.qbitai.com/2025/12/360465.html,"早期融资,电动化,智能化,硬件创业",2025-12-12 08:40:08
2025-12-12,国内,15,IDC MarketScape：商汤科技位居中国AI咨询服务市场领导者类别,12月12日消息，国际研究机构IDC发布报告，将商汤科技评为中国AI咨询服务市场的领导者，认可其“大装置-大模型-应用”三位一体战略以及从技术到业务的全流程AI专家服务能力，标志着其在企业AI转型服务方面获得权威认可。,低,162.0,属于【重大商业动态】，权威市场报告确认中国AI公司在细分市场（AI咨询）的领导地位，是对其综合服务能力的背书。,36氪,https://36kr.com/p/3591005465526275?f=rss,"市场报告,AI服务,商汤科技,领导者",2025-12-12 08:40:08
2025-12-12,国内,16,《时代》周刊公布2025“年度人物”，李彦宏等“AI的建造者们”接受专访,12月12日消息，《时代》周刊将2025年年度人物授予“AI的建造者们”，百度创始人李彦宏作为中国AI领军人物代表接受专访，报道肯定了百度从搜索引擎向全栈人工智能公司的转型及其在芯片、模型、应用等方面的布局。,低,150.0,属于【重大商业动态】，中国AI企业领袖获得国际顶级媒体关注和认可，反映了中国在全球AI产业中的影响力提升。,机器之心,https://www.jiqizhixin.com/articles/2025-12-12-2,"国际认可,人物专访,百度,李彦宏",2025-12-12 08:40:08
2025-12-12,国内,17,海光CPU创始人唐志敏：软件才是国产芯片公司的“命根子” | GAIR 2025,12月12日消息，海光CPU创始人唐志敏在公开演讲中指出，国产芯片发展的根本问题在于软件生态而非硬件性能，国内芯片指令集与软件接口的混乱导致社会承担高昂的兼容成本，呼吁行业重视软件统一与生态建设。,低,150.0,属于【重大学术/产业观点】，中国芯片产业资深专家提出关于国产芯片发展核心瓶颈（软件生态）的重要观点，具有行业洞察价值。,AI科技评论,https://www.leiphone.com/category/ai/o7xgwIlwLURXTuKx.html,"产业观点,国产芯片,软件生态,海光",2025-12-12 08:40:08
2025-12-12,国际,1,Trump Signs Executive Order That Threatens to Punish States for Passing AI Laws,12月12日消息，美国总统特朗普签署了一项行政命令，旨在建立联邦政府对AI监管的统一标准，并指示司法部成立工作组挑战各州的AI法律，同时威胁对通过“繁重”立法的州削减宽带资金，此举被视为对大型科技公司游说联邦标准的重大胜利。,高,405.0,重大政策与法规：美国联邦政府层面的AI监管行政命令，直接影响各州立法权和科技公司，属于最高优先级的政策动态。,Wired AI,https://www.wired.com/story/trump-signs-executive-order-ai-state-laws/,"美国政策,AI监管,行政命令",2025-12-12 08:40:08
2025-12-12,国际,2,"GPT-5.2 first impressions: a powerful update, especially for business tasks and workflows",12月12日消息，美国公司OpenAI正式发布了其新一代前沿大语言模型GPT-5.2，早期测试者反馈显示该模型在深度自主推理和编码方面实现了巨大飞跃，旨在应对来自谷歌Gemini 3等竞争对手的压力，并提升专业工作任务的性能。,高,396.0,重大产品发布：OpenAI旗舰模型GPT-5.2的正式发布，是AI产业核心竞争力的关键更新，属于最高优先级的商业与技术动态。,VentureBeat AI,https://venturebeat.com/ai/gpt-5-2-first-impressions-a-powerful-update-especially-for-business-tasks,"OpenAI,GPT-5.2,模型发布",2025-12-12 08:40:08
2025-12-12,国际,3,TIME names ‘Architects of AI’ its Person of the Year,12月12日消息，《时代》周刊将“AI架构师”群体评选为年度人物，其中包括英伟达黄仁勋、OpenAI山姆·阿尔特曼、谷歌DeepMind德米斯·哈萨比斯、Meta马克·扎克伯格、AMD苏姿丰、Anthropic达里奥·阿莫代等全球AI产业领袖，标志着AI对全球社会的深远影响获得主流认可。,高,372.5,重大商业/社会动态：全球顶级媒体对AI产业领袖群体的集中认可，反映了AI技术在全球范围内的巨大影响力，属于高影响力的行业标志性事件。,TechCrunch AI,https://techcrunch.com/2025/12/11/time-names-architects-of-ai-its-person-of-the-year/,"行业荣誉,AI领袖,社会影响",2025-12-12 08:40:08
2025-12-12,国际,4,Trump signs AI executive order pushing to ban state laws,12月12日消息，美国总统特朗普签署了一项关于人工智能的行政命令，旨在为联邦政府夺取AI监管的单方面权力，以限制各州在监管人工智能方面的权力，并建立一个全国统一的AI监管标准框架。,高,366.0,重大政策与法规：进一步明确了特朗普行政命令的核心内容——联邦与州在AI监管权上的博弈，是理解美国未来AI政策走向的关键信息。,NVIDIA AI,https://blogs.nvidia.com/blog/leading-models-nvidia/,"美国政策,联邦监管,AI法律",2025-12-12 08:40:08
2025-12-12,国际,5,Disney wants to drag you into the slop,12月12日消息，美国娱乐巨头迪士尼与OpenAI达成了一项价值10亿美元的战略合作伙伴关系，迪士尼将获得OpenAI的API和Sora视频生成器等工具访问权限，并计划允许用户使用迪士尼旗下角色生成AI视频内容，标志着主流IP大规模拥抱生成式AI。,高,275.0,重大商业动态：涉及迪士尼与OpenAI两家巨头，合作金额高达10亿美元，且涉及核心IP与生成式AI视频的深度融合，具有行业风向标意义。,The Verge AI,https://www.theverge.com/ai-artificial-intelligence/841817/trump-signs-ai-executive-order-pushing-to-ban-state-laws,"战略合作,迪士尼,OpenAI,Sora",2025-12-12 08:40:08
2025-12-12,国际,6,SoftBank’s Son Eyes Data Center Group Switch to Expand in AI,12月12日消息，日本软银集团正考虑收购数据中心运营商Switch Inc.等潜在目标，这凸显了其创始人孙正义日益增长的野心，旨在抓住人工智能推动的数字基础设施繁荣机遇，扩大在AI基础设施领域的布局。,高,264.0,重大商业动态：软银作为全球重要科技投资方，其针对AI数据中心的大规模收购意向，反映了AI算力基础设施领域的投资热度与战略重要性。,VentureBeat AI,https://venturebeat.com/ai/openais-gpt-5-2-is-here-what-enterprises-need-to-know,"软银,并购,数据中心,AI基础设施",2025-12-12 08:40:08
2025-12-12,国际,7,Google launched its deepest AI research agent yet — on the same day OpenAI dropped GPT-5.2,12月12日消息，谷歌发布了其迄今为止最深入的AI研究代理工具“深度研究”，该工具基于Gemini 3 Pro模型构建，并首次允许开发者将其嵌入自己的应用程序中，标志着AI研究辅助工具进入更广泛的商业化应用阶段。,高,264.0,重大产品发布：谷歌在OpenAI发布GPT-5.2同日推出重要AI工具，体现了巨头间的直接竞争，且该产品面向开发者生态，具有重要商业价值。,TechCrunch AI,https://techcrunch.com/2025/12/11/openai-fires-back-at-google-with-gpt-5-2-after-code-red-memo/,"谷歌,Gemini,AI工具,产品发布",2025-12-12 08:40:08
2025-12-12,国际,8,Google’s answer to the AI arms race — promote the guy behind its data center tech,12月12日消息，谷歌将其AI基础设施负责人Amin Vahdat提升为新设立的“AI基础设施首席技术官”一职，直接向CEO皮查伊汇报，此举旨在强化其在AI算力竞赛中的领导力，凸显了基础设施在AI军备竞赛中的核心战略地位。,中,255.0,重大商业动态：反映了谷歌在AI竞赛中内部组织架构的战略调整，将基础设施负责人提升至最高决策层，显示了其对底层算力建设的极度重视。,arXiv AI,https://arxiv.org/abs/2512.10058,"谷歌,组织架构,AI基础设施,人事任命",2025-12-12 08:40:08
2025-12-12,国际,9,Mind the Gap! Pathways Towards Unifying AI Safety and Ethics Research,12月12日消息，arXiv发布了一篇题为《注意差距！统一AI安全与伦理研究的路径》的新论文，该研究指出，随着AI能力快速扩展，关于对齐、安全与伦理的研究却出现分歧，并探讨了如何整合这些关键领域以应对日益紧迫的AI系统无害化挑战。,中,255.0,重大学术突破：该论文聚焦于AI安全与伦理这一核心前沿议题，提出了统一研究路径的思考，对全球AI治理和未来发展具有重要的学术参考价值。,Bloomberg Technology,https://www.bloomberg.com/news/articles/2025-12-12/softbank-eyes-data-center-group-switch-as-son-hunts-for-ai-plays,"AI安全,AI伦理,学术论文,对齐",2025-12-12 08:40:08
2025-12-12,国际,10,Investigating The Functional Roles of Attention Heads in Vision Language Models: Evidence for Reasoning Modules,12月12日消息，arXiv发布了一项关于视觉语言模型可解释性的新研究，该研究提出了一个新颖的框架来系统分析VLM的内部机制，重点关注注意力头的功能角色，并发现了支持推理模块存在的证据，有助于揭开多模态AI的“黑箱”。,中,249.0,重大学术突破：针对当前火热的视觉语言模型，提出了新的可解释性分析框架，并发现了推理模块的证据，属于AI基础研究领域的重要进展。,TechCrunch AI,https://techcrunch.com/2025/12/11/google-launched-its-deepest-ai-research-agent-yet-on-the-same-day-openai-dropped-gpt-5-2/,"VLM,可解释性,学术研究,多模态AI",2025-12-12 08:40:08
2025-12-12,国际,11,Medra Raises $52 Million to Speed Drug Discovery With AI Robots,12月12日消息，美国生物科技公司Medra成功融资5200万美元，该公司通过AI编程机器人来进行和优化生物实验，计划利用这笔资金在美国建设最大的自动化实验室之一，以加速AI在药物发现领域的应用。,中,249.0,重大商业动态：AI+机器人+生物制药的交叉领域获得大额融资，代表了AI在垂直行业（尤其是生命科学）应用的重要进展和投资趋势。,Wired AI,https://www.wired.com/story/openai-gpt-launch-gemini-code-red/,"AI制药,融资,机器人,生物科技",2025-12-12 08:40:08
2025-12-12,国际,12,Oracle Slides by Most Since January on Mounting AI Spending,12月12日消息，甲骨文公司股价出现大幅下跌，原因是其财报显示在AI数据中心及其他设备上的支出大幅增加，引发了市场对AI相关资本开支激增可能影响短期利润的担忧，反映了云厂商在AI军备竞赛中面临的财务压力。,中,240.0,重大商业动态：作为主要云服务商，甲骨文的财报和股价波动直接反映了AI基础设施竞赛对企业财务状况的实质性影响，是观察行业趋势的重要指标。,CNBC Tech,https://www.cnbc.com/2025/12/11/harness-is-worth-5point5-billion-in-round-led-by-goldman-sachs.html,"甲骨文,财报,AI支出,资本市场",2025-12-12 08:40:08
