date,category,index,title,summary,importance,impact_score,reason,source,url,tags,created_at
2025-12-18,国际,4,"Gemini 3 Flash is here, bringing a ‘huge’ upgrade to the Gemini app","12月18日消息，Google is upgrading its Gemini app with Gemini 3 Flash, a more efficient version of its flagship AI model that's still capable of fielding complex requests. The new model will replace Gemini 2.5 Flash",高,249.0,影响力评分: 249.0,The Verge AI,https://www.theverge.com/news/845741/gemini-3-flash-google-ai-mode-launch,"Gemini 3,AI,Gemini 2",2025-12-18 08:18:41
2025-12-18,国际,5,"OpenAI Discussed Funding at $750 Billion Value, Report Says","12月18日消息，OpenAI has held funding talks with investors to raise tens of billions of dollars at a valuation of $750 billion, according to a report in the Information.",高,240.0,影响力评分: 240.0,Bloomberg Technology,https://www.bloomberg.com/news/articles/2025-12-18/openai-discussed-funding-at-750-billion-value-information-says,"AI,valuation,billion",2025-12-18 08:18:41
2025-12-18,国际,6,Investors Question Oracle’s Data Center Financing | Bloomberg Tech 12/17/2025,"12月18日消息，Bloomberg’s Caroline Hyde discusses questions surrounding Oracle’s data-center financing. Plus, OpenAI is in talks to raise $10 billion from Amazon and plans to use its Trainium chip in a challenge to",高,240.0,影响力评分: 240.0,Bloomberg Technology,https://www.bloomberg.com/news/videos/2025-12-17/bloomberg-tech-12-17-2025-video,"AI,valuation,billion",2025-12-18 08:18:41
2025-12-18,国际,7,Imprint Payments Propelled to $1.2B Valuation,"12月18日消息，Daragh Murphy, Imprint CEO, discusses the company’s latest funding round, which has vaulted the company to a $1.2 billion valuation. He joins Caroline Hyde on “Bloomberg Tech.” (Source: Bloomberg)",高,240.0,影响力评分: 240.0,Bloomberg Technology,https://www.bloomberg.com/news/videos/2025-12-17/imprint-payments-propelled-to-1-2b-valuation-video,"valuation,joins,billion,CEO",2025-12-18 08:18:41
2025-12-18,国际,8,Nemotron-Math: Efficient Long-Context Distillation of Mathematical Reasoning from Multi-Mode Supervision,"12月18日消息，arXiv:2512.15489v1 Announce Type: new Abstract: High-quality mathematical reasoning supervision requires diverse reasoning styles, long-form traces, and effective tool integration, capabilities that e",高,200.0,影响力评分: 200.0,arXiv AI,https://arxiv.org/abs/2512.15489,"AGI,reasoning,AI,valuation",2025-12-18 08:18:41
2025-12-18,国际,9,"Amazon says AI chief Rohit Prasad is leaving, Peter DeSantis to lead 'AGI' group","12月18日消息，Rohit Prasad, a top Amazon executive overseeing its artificial general intelligence unit, is leaving at the end of this year, the company confirmed.",高,200.0,影响力评分: 200.0,CNBC Tech,https://www.cnbc.com/2025/12/17/amazon-ai-chief-prasad-leaving-peter-desantis-agi-group.html,"AGI,AI,artificial general intelligence,chief",2025-12-18 08:18:41
2025-12-18,国际,10,See Rise of AI Generated Attacks: Exein CEO,"12月18日消息，The cybersecurity firm Exein has raised €100 million in additional funding, bringing the total raised this year to €170 million. It's been a year of hyper-growth for the Italian startup, backed by JP ",高,195.0,影响力评分: 195.0,Bloomberg Technology,https://www.bloomberg.com/news/videos/2025-12-18/see-rise-of-ai-generated-attacks-exein-s-cuozzo-video,"AI,founder,valuation,CEO",2025-12-18 08:18:41
2025-12-18,国际,11,Micron Gives Rosy Sales Forecast As AI Boom Spurs Demand,"12月18日消息，Micron Technology, the largest US maker of computer memory chips, gave an upbeat forecast for the current quarter, a sign that surging demand and supply shortages are allowing the company to charge mo",高,195.0,影响力评分: 195.0,Bloomberg Technology,https://www.bloomberg.com/news/videos/2025-12-17/micron-gives-rosy-sales-forecast-as-ai-boom-spurs-demand-video,"joins,AI,chief,billion",2025-12-18 08:18:41
2025-12-18,国际,12,Portal's Flavin on Biotech & Pharma Deals in 2026,"12月18日消息，John Flavin, founder and CEO of Portal Innovations, says billions of dollars in biotech M&A have taken place this year. He tells Romaine Bostick and Katie Greifeld on “The Close” that new offerings ar",高,195.0,影响力评分: 195.0,Bloomberg Technology,https://www.bloomberg.com/news/videos/2025-12-17/portal-s-flavin-on-biotech-pharma-deals-in-2026-video,"AI,founder,billion,CEO",2025-12-18 08:18:41
2025-12-18,国际,13,Amazon overhauls AI team as chief declares an ‘inflection point’,12月18日消息，Peter DeSantis appointed to oversee a new group leading the company’s artificial intelligence model development,高,180.0,影响力评分: 180.0,Financial Times Tech,https://www.ft.com/content/f3092c2d-f428-4ff4-bdbd-9a27b12bcae2,"appointed,AI,artificial intelligence,chief",2025-12-18 08:18:41
2025-12-18,国际,14,Commission publishes first draft of Code of Practice on marking and labelling of AI-generated content,"12月18日消息，Commission publishes first draft of Code of Practice on marking and labelling of AI-generated content marsrgi Wed, 12/17/2025 - 09:52 The first draft of the Code of Practice on marking and labelling o",高,180.0,影响力评分: 180.0,EU AI Policy,https://digital-strategy.ec.europa.eu/en/news/commission-publishes-first-draft-code-practice-marking-and-labelling-ai-generated-content,"AI Act,AI,deepfake",2025-12-18 08:18:41
2025-12-18,国际,15,First Draft Code of Practice on Transparency of AI-Generated Content,"12月18日消息，First Draft Code of Practice on Transparency of AI-Generated Content marsrgi Wed, 12/17/2025 - 11:30 This first draft of the Code addresses key considerations for providers and deployers of AI systems",高,165.0,影响力评分: 165.0,EU AI Policy,https://digital-strategy.ec.europa.eu/en/library/first-draft-code-practice-transparency-ai-generated-content,"AI,artificial intelligence,fine",2025-12-18 08:18:41
2025-12-18,国际,16,Alphabet-owned Waymo in talks to raise $15 billion in funding,"12月18日消息，The funding round would give Waymo a valuation as high as $110 billion, a person familiar with the matter told CNBC.",高,165.0,影响力评分: 165.0,CNBC Tech,https://www.cnbc.com/2025/12/16/alphabet-owned-waymo-in-talks-to-raise-15-billion-in-funding.html,"AI,valuation,billion",2025-12-18 08:18:41
2025-12-18,国际,17,Gemini 3 Flash arrives with reduced costs and latency — a powerful combo for enterprises,"12月18日消息，Enterprises can now harness the power of a large language model that's near that of the state-of-the-art Google’s Gemini 3 Pro , but at a fraction of the cost and with increased speed, thanks to the n",高,162.0,影响力评分: 162.0,VentureBeat AI,https://venturebeat.com/technology/gemini-3-flash-arrives-with-reduced-costs-and-latency-a-powerful-combo-for,"Gemini 3,joins,large language model,state-of-the-art,AI",2025-12-18 08:18:41
2025-12-18,国际,18,The ChatGPT app store is here,"12月18日消息，On Wednesday evening, OpenAI launched an App Directory to browse all the tools currently available and opened its SDK for developers to build new interactive experiences that operate within the bot's ",高,158.0,影响力评分: 158.0,The Verge AI,https://www.theverge.com/news/847067/openai-app-store-directory-sdk-chatgpt,"Sam Altman,AI,CEO",2025-12-18 08:18:41
2025-12-18,国际,19,"Mozilla’s new CEO says AI is coming to Firefox, but will remain a choice",12月18日消息，Mozilla has appointed Anthony Enzor-DeMeo as its CEO as the Firefox developer scrambles to adapt in a rapidly changing browser market.,高,158.0,影响力评分: 158.0,TechCrunch AI,https://techcrunch.com/2025/12/17/mozillas-new-ceo-says-ai-is-coming-to-firefox-but-will-remain-a-choice/,"appointed,AI,CEO",2025-12-18 08:18:41
2025-12-18,国际,20,Time for Europe to stop making excuses and step up: EuroStack's Caffarra,"12月18日消息，Europe has neglected to build up its own tech industry, leaving the continent little more than a digital colony of American suppliers, argues EuroStack Founder & Chair Cristina Caffarra. Europe's focu",高,157.5,影响力评分: 157.5,Bloomberg Technology,https://www.bloomberg.com/news/videos/2025-12-18/time-for-europe-to-stop-making-excuses-and-step-up-eurostack-s-caffarra,"AGI,AI,founder",2025-12-18 08:18:41
2025-12-19,国内,1,高端汽车市场创2亿营收，「悉智科技」拓疆AIDC蓝海 ｜36氪首发,12月19日消息，作者丨欧雪 编辑丨袁斯来 硬氪获悉，宽禁带电力电子零部件供应商「悉智科技」近日完成2.5亿元Pre-A轮融资。我们总结了本轮融资信息和该公司几大亮点： 融资金额及领投机构 融资轮次： Pre-A轮 融资规模： 2.5亿元人民币 投资方： 安芯资本、浙江省新能源汽车基金、交银国际等 融资用途： 新产品研发、新厂房建设和AIDC事业部扩充 公司基本信息 成立时间： 2022年 成立地点： 苏州 技术亮,高,357.5,影响力评分: 357.5,36氪,https://36kr.com/p/3601841999037444?f=rss,"融资,AI,创新,投资,CEO",2025-12-19 08:18:39
2025-12-19,国内,2,每日路演精选项目｜人工智能、低空经济、新材料、生物制造、核聚变等领域,12月19日消息，36氪作为 中国最大的新经济媒体平台 ，过去通过与投资机构、基金合伙人的深度合作，大幅提升企业融资机会。随着新经济不断发展的十年，36氪沉淀和积累了大量一级市场投资人资源。 「每日路演」 是针对优质创业项目开放投资人社群、进行新型的线上闭门路演，持续为创业者与投资人两端提供深度运营服务。 to 高潜创业者-高效输出公司价值亮点+与投资人进行深度交流；to 投资人与投资机构-多维度、低成本对话项目决,高,337.5,影响力评分: 337.5,36氪,https://36kr.com/p/3600788540309509?f=rss,"合作,融资,人工智能,突破,大模型",2025-12-19 08:18:39
2025-12-19,国内,3,乐欣户外港股IPO获中国证监会备案,"12月19日消息，36氪获悉，中国证监会国际合作司发布关于Ridge Outdoor International Limited（乐欣户外国际有限公司）境外发行上市备案通知书，公司拟发行不超过38,332,500股境外上市普通股并在香港联合交易所上市。",高,307.5,影响力评分: 307.5,36氪,https://36kr.com/newsflashes/3602168673633542?f=rss,"上市,IPO,合作,发布",2025-12-19 08:18:39
2025-12-19,国内,4,溜溜果园港股IPO及境内未上市股份“全流通”获中国证监会备案,"12月19日消息，36氪获悉，中国证监会国际合作司发布关于溜溜果园集团股份有限公司境外发行上市及境内未上市股份“全流通”备案通知书，公司拟发行不超过19,362,400股境外上市普通股并在香港联合交易所上市。",高,307.5,影响力评分: 307.5,36氪,https://36kr.com/newsflashes/3602166488581380?f=rss,"上市,IPO,合作,发布",2025-12-19 08:18:39
2025-12-19,国内,5,海澜之家与阿迪达斯「抱团取暖」,12月19日消息，作者 | 谢芸子 编辑 | 张帆 “男人的衣柜”又要上市了。 近日，A股上市公司、“一年逛两次”的海澜之家向港交所递交上市申请。然而，资本市场的反应却颇为冷淡——招股书宣布后的11月24日，海澜之家股价下跌2.71%。也正是这一天，海澜之家正式被剔除出MSCI中国指数，这反映出国际资本对其未来成长性的质疑。 近两年，海澜之家的业绩数据也有所下滑。在2025年第三季度的财报中，尽管公司的营收微增，归,高,292.5,影响力评分: 292.5,36氪,https://36kr.com/p/3601800208237824?f=rss,"上市,IPO,合作",2025-12-19 08:18:39
2025-12-19,国内,6,OpenAI最强代码模型GPT-5.2-Codex上线,12月19日消息，,高,285.0,影响力评分: 285.0,机器之心,https://www.jiqizhixin.com/articles/2025-12-19-3,"AI,上线,GPT-5",2025-12-19 08:18:39
2025-12-19,国内,7,云天励飞罗忆：推理超越训练，国产算力的真正战场在生态与成本丨GAIR 2025,12月19日消息，2025年12月12-13日，第八届GAIR全球人工智能与机器人大会在深圳·博林天瑞喜来登酒店正式启幕。 作为AI 产学研投界的标杆盛会，GAIR自2016年创办以来，始终坚守“传承+创新”内核，始终致力于连接技术前沿与产业实践。 在人工智能逐步成为国家竞争核心变量的当下，算力正以前所未有的速度重塑技术路径与产业结构。13日举办的「AI 算力新十年」专场聚焦智能体系的底层核心——算力，从架构演进、,高,270.0,影响力评分: 270.0,AI科技评论,https://www.leiphone.com/category/chips/QZ9ciwCVpIGzzIId.html,"人工智能,突破,大模型,AI,超越",2025-12-19 08:18:39
2025-12-19,国内,8,独家丨「轻量智造」获头部激光上市企业追投，创始人是前安克3D打印机负责人,12月19日消息，雷峰网·鲸犀独家获悉，3D打印品牌轻量智造正式宣布完成天使轮融资，本轮融资由头部激光上市企业旗下基金海欣资本领投，南山战新投跟投。 轻量智造成立于2025年4月，由前安克3D打印机负责人王志宇创立。王志宇是机械设计专业出身，离开安克前，曾先后任职于三一重工、华为、创想三维等公司。 轻量智造已组建了一支近40人的团队，初期将专注于3D打印批量制造这一细分赛道，首款产品已完成样机开发，预计于2026年,高,260.0,影响力评分: 260.0,AI科技评论,https://www.leiphone.com/category/weiwu/8vCty5pPN5rXlMPf.html,"上市,百亿,正式推出,融资",2025-12-19 08:18:39
2025-12-19,国内,9,2025手机三国杀：小米涨价了、华为重回王位、苹果不装了丨36氪年度透视②,12月19日消息，“透视图”栏目在年终特别策划了“36氪年度总结”系列，用数据透视2025全年趋势，以图片呈现今年商业世界中不可错过的要点。 作者｜邱晓芬 2025年，手机圈在成本飙升的“超级周期”中迎来残酷洗牌。当零部件成本普涨10%-25%，市场被一道600美金的红线切开：中低端陷入存量塌陷，唯有高端市场凭借AI与生态逆势扩张。 36氪制图 苹果：不装了，基础款也给“全家桶” 面对国产追击，苹果不再矜持。iPh,高,236.0,影响力评分: 236.0,36氪,https://36kr.com/p/3602054668289283?f=rss,"AI,超越,首次",2025-12-19 08:18:39
2025-12-19,国内,10,追觅科技中国区2026合作伙伴大会圆满落幕 全面加速全场景生态布局,12月18日，2026追觅科技中国区合作伙伴大会在苏州圆满举行。本次大会以“敢为新竞 共生未来”为主题，来自全国各地的500余位核心合作伙伴齐聚一堂，共同见证追觅全场景生态布局的新进展。同时，面向2026，追觅中国区将与合作伙伴合力把增长推上新台阶，向“15亿级”开门红规模迈进。 大会现场，超40款新品集中亮相，涵盖清洁、个护、大家电、厨电、智能家居五大场景。全场景融合体验区吸引众多合作伙伴深度体,高,225.0,影响力评分: 225.0,AI科技评论,https://www.leiphone.com/category/industrynews/q5NzjcvmAJW0el4m.html,"合作,AI,开放,创新,发布",2025-12-19 08:18:39
2025-12-19,国内,11,大族数控港股上市获中国证监会备案,"12月19日消息，36氪获悉，中国证监会国际合作司发布关于深圳市大族数控科技股份有限公司境外发行上市备案通知书，公司拟发行不超过88,625,200股境外上市普通股并在香港联合交易所上市。",高,210.0,影响力评分: 210.0,36氪,https://36kr.com/newsflashes/3602158508770310?f=rss,"上市,合作,发布",2025-12-19 08:18:39
2025-12-19,国内,12,AI破解出海增长困局，易蛙智能助力商家实现效率平权,12月19日消息，2025年，AI Agent从概念走向商业化落地，“用AI赚钱”成为创业者和投资人最关心的话题之一，在垂直领域形成闭环、直接创造商业价值的AI产品不断涌现。 其中，跨境电商——这个被视作“流量红海”与“增长蓝海”的矛盾综合体无疑是应用落地的热门场景。一方面，TikTok等社交电商平台成为销量增长的新引擎；另一方面，中小卖家又难以应对内容创作效率低、广告成本激增、达人合作难起量等复杂挑战。 在充满不,高,210.0,影响力评分: 210.0,36氪,https://36kr.com/p/3602109849764871?f=rss,"AI,合作,投资",2025-12-19 08:18:39
2025-12-19,国内,13,MaaS市场权威报告：阿里云获5项最高评级，为中国第一,12月18日，国际市场研究机构 Omdia 发布最新报告《2025年全球企业级MaaS市场分析》（以下简称“报告”），提出9项评估维度。阿里云获评全球领导者，并在5大维度上获得最高评级，为中国第一；在国际上仅次于AWS，与Azure、谷歌云持平。 MaaS意为“模型即服务 (Model as a Service)”，通过API 接口、应用或集成解决方案等，向用户提供服务。2022年，阿里云首次在业,高,210.0,影响力评分: 210.0,AI科技评论,https://www.leiphone.com/category/industrynews/X4tPMf6QFIVGbyub.html,"首次,开源,大模型,AI,发布",2025-12-19 08:18:39
2025-12-19,国内,14,自主创新大讲堂——星火沙龙计划项目“机器视觉技术”圆满举行,12月19日消息，2025年12月17日，由深圳市科学技术协会指导，深圳市人工智能学会主办，深圳市人工智能学会青工委和中山大学·深圳承办的“机器视觉技术沙龙”在中山大学深圳校区工学园1-134会议室成功举办。活动汇聚了来自高校与企业的多位专家学者，围绕机器视觉领域的前沿理论、关键技术与应用趋势展开深入交流与研讨，旨在加强学术界与产业界之间的沟通协作，推动前沿技术在深圳的实际应用探索。本次沙龙紧扣新一代人工智能与新质,高,200.0,影响力评分: 200.0,AI科技评论,https://www.leiphone.com/category/industrynews/9FWu1F49XTbpSuCX.html,"人工智能,合作,突破,大模型,创新",2025-12-19 08:18:39
2025-12-19,国内,15,GDPS 2025｜宇树、智元首次同台，上海如何以「应用」领跑具身智能竞赛？,12月19日消息，大模型的兴起给具身智能带来了前所未有的发展，在实验室场景里，机器人的抓取、开箱、简单装配等短—中期操作任务的平均成功率落在 90%–98% 区间。 然而，实验室的成果，不一定是工程化的成功。对于具身智能的落地，一个本质问题是： 当下的机器人究竟能在多大程度上服务于真实的生产、生活场景？ 昨日开幕的全球开发者先锋大会（GDPS 2025），想到了一个办法去客观地评价和衡量这个问题。作为全球首个全面对,高,200.0,影响力评分: 200.0,AI科技评论,https://www.leiphone.com/category/ai/KiKn7m7ehl97gpSM.html,"创新,大模型,开放,首次",2025-12-19 08:18:39
2025-12-19,国内,16,AI硬件如何商业化？有道AI答疑笔给出最优解,12月19日消息，当前，全球AI硬件领域正经历从“概念热”向“商业化验证”的关键转折。科技巨头与创业公司纷纷涌入，从豆包手机、AR眼镜到智能耳机，竞相争夺下一代人机交互入口。 在此背景下，能否找到一个高频、刚需且用户愿意持续付费的垂直场景，成为硬件能否跨越商业鸿沟的分水岭。 近日，网易有道旗下AI原生硬件——有道AI答疑笔Space X上市不到一年销售额突破一亿元。科技博主“科技侠来了”在其解读视频中指出，这一案例,高,200.0,影响力评分: 200.0,AI科技评论,https://www.leiphone.com/category/industrynews/cIkO5mzCfwHlzYrD.html,"创新,上市,AI,突破",2025-12-19 08:18:39
2025-12-19,国内,17,nova 15系列：以“史上最好看nova”出圈，拆解邀请函背后的隐藏信息,12月19日，随着华为终端上线nova 15系列与潮流IP Robbi的联名海报，并共同推出“一键开启带感模式”的H5换头像互动与全民发布会邀请函，新品的发布氛围被推向顶点。从首日官宣到连日来密集释出的代言人大片、四色创拍海报与极具张力的模特群像大片，一系列动作不仅呈现了nova系列全新的设计语言，更精准勾勒出其潮流、先锋、自信的鲜明品牌调性。而此次互动邀请，如同划破夜空的信号弹，将所有追求潮酷与,高,195.0,影响力评分: 195.0,AI科技评论,https://www.leiphone.com/category/industrynews/NuusF4h0pyW9fLtr.html,"CEO,上线,发布",2025-12-19 08:18:39
2025-12-19,国内,18,中山大学王广润：大模型的微调只是对空间建模的微调 | GAIR 2025,12月19日消息，相比于虚拟世界，真实的世界充斥着动态变化的环境变量和各种各样的物理规则，这要求基础模型不仅具备强大的感知与计算能力，更需拥有理解物理规律、预判场景变化的综合能力。 在此背景下，基础模型的能力边界不断被突破，而新一代AI架构与物理世界建模作为全球AI领域最核心的前沿探索方向之一，更是成为技术突破的关键抓手。 如何通过新一代AI架构的创新迭代，赋能物理世界建模的精准化、高效化，让AI更好地理解、建模并,高,185.0,影响力评分: 185.0,AI科技评论,https://www.leiphone.com/category/academic/ouFiY3xYE5TD3LHa.html,"人工智能,突破,大模型,AI,创新",2025-12-19 08:18:39
2025-12-19,国内,19,小鹏X9超级增程搭载华为「心脏」，小鹏副总裁表态：未来合作无上限,12月19日消息，在华为松山湖园区古典城堡建筑的衬托下，刚刚完成上市的小鹏X9超级增程版多了几分沉淀感。 12月2日，小鹏与华为宣布，小鹏X9超级增程全球首发搭载华为DriveONE全栈高集成高压油冷发电机，该发电机也是小鹏鲲鹏超级增程技术的“心脏”。 这是今年双方的第二次正式技术合作。今年的6月，小鹏与华为联合发布车载AR-HUD，并首发搭载于小鹏G7。 小鹏X9超级增程是小鹏与华为在2024年11月达成全面增程,高,180.0,影响力评分: 180.0,AI科技评论,https://www.leiphone.com/category/transportation/Nx3kypmzaxTmx2qp.html,"上市,对齐,合作,发布",2025-12-19 08:18:39
2025-12-19,国内,20,「优甜生物」获数千万元天使轮融资，量产高端甜蛋白 | 36氪首发,12月19日消息，36氪获悉，合成生物公司「优甜生物」近日获数千万元天使轮融资，由常州启航合成生物创投基金领投，本轮资金将重点用于落地索马甜的规模化量产，拓展合成生物产品管线，及技术平台迭代。 优甜生物成立于2023年，创始人、董事长崔俊生毕业于南开大学生物专业，是一位连续创业者，曾参与完成了国家“863”重大新药创制课题；主导开发的全球首款DR4/DR5靶点抗肿瘤靶向蛋白新药，完成BD授权。 基于在蛋白药物开发、,高,175.5,影响力评分: 175.5,36氪,https://36kr.com/p/3600448428343304?f=rss,"AI,融资,风险,突破",2025-12-19 08:18:39
2025-12-19,国际,1,"NVIDIA, US Government to Boost AI Infrastructure and R&D Investments Through Landmark Genesis Mission",12月19日消息，NVIDIA will join the U.S. Department of Energy’s (DOE) Genesis Mission as a private industry partner to keep U.S. AI both the leader and the standard in technology around the world. The Genesis Missio,高,275.0,影响力评分: 275.0,NVIDIA AI,https://blogs.nvidia.com/blog/nvidia-us-government-to-boost-ai-infrastructure-and-rd-investments/,"executive order,AI,fine",2025-12-19 08:18:39
2025-12-19,国际,2,AMUSE: Audio-Visual Benchmark and Alignment Framework for Agentic Multi-Speaker Understanding,"12月19日消息，arXiv:2512.16250v1 Announce Type: new Abstract: Recent multimodal large language models (MLLMs) such as GPT-4o and Qwen3-Omni show strong perception but struggle in multi-speaker, dialogue-centric set",高,200.0,影响力评分: 200.0,arXiv AI,https://arxiv.org/abs/2512.16250,"large language model,reasoning,alignment,AI,multimodal",2025-12-19 08:18:39
2025-12-19,国际,3,Code-in-the-Loop Forensics: Agentic Tool Use for Image Forgery Detection,"12月19日消息，arXiv:2512.16300v1 Announce Type: new Abstract: Existing image forgery detection (IFD) methods either exploit low-level, semantics-agnostic artifacts or rely on multimodal large language models (MLLMs",高,200.0,影响力评分: 200.0,arXiv AI,https://arxiv.org/abs/2512.16300,"large language model,reasoning,AI,fine,multimodal",2025-12-19 08:18:39
2025-12-19,国际,4,AI Needs Physics More Than Physics Needs AI,"12月19日消息，arXiv:2512.16344v1 Announce Type: new Abstract: Artificial intelligence (AI) is commonly depicted as transformative. Yet, after more than a decade of hype, its measurable impact remains modest outside",高,200.0,影响力评分: 200.0,arXiv AI,https://arxiv.org/abs/2512.16344,"large language model,artificial intelligence,AI,Nobel,bias",2025-12-19 08:18:39
2025-12-19,国际,5,Do Large Language Models Know What They Don't Know? Kalshibench: A New Benchmark for Evaluating Epistemic Calibration via Prediction Markets,"12月19日消息，arXiv:2512.16030v1 Announce Type: new Abstract: A well-calibrated model should express confidence that matches its actual accuracy -- when it claims 80\% confidence, it should be correct 80\% of the t",高,195.0,影响力评分: 195.0,arXiv AI,https://arxiv.org/abs/2512.16030,"large language model,AI,Opus,GPT-5,LLM",2025-12-19 08:18:39
